flow_form_id,flow_question_group,flow_question_label,flow_question_id,mis_form_id,mis_question_group,mis_question_label,mis_question_id,match_score,match_confidence,match_method
8520967,Water Treatment Plant Registration,Name of Plant (Western),9580922,,,,,65.0,none,none
8520967,Chemicals,What are the risks?,1680929,1749652214711.0,Chemicals,What are the Issues / risks? Please Provide Details of the issues /issues for Lime Dosing:,1749696996243.0,100.0,high,manual
8520967,Chemicals,What are the risks?,6650921,1749652214711.0,Chemicals,Please Provide Details of the issues/ risks for Polymer Dosing,1749696684785.0,100.0,high,manual
8520967,Chemicals,What are the risks?,7620921,1749652214711.0,Chemicals,What are these risks associated with Chlorine Gas dosing?,1749698753569.0,100.0,high,manual
8520967,Chemicals,What are the risks?,7970920,,,,,0.0,none,manual
8520967,Chemicals,What are the risks?,9670921,1749652214711.0,Chemicals,What are the risks associated with Soda Ash dosing?,1749696465230.0,100.0,high,manual
8520967,Plant Mag Flow Meters,Take Photo of the risks,7610938,1749652214711.0,Plant Mag Flow Meters,Take Photo of the risks associated with the flow meters,1749699295063.0,100.0,high,manual
8520967,Raw Water Source,Are you able to take photo of risk?,13770920,1749652214711.0,Raw Water Source,Are you able to take photo of the risks for the surface water source?,1749693712512.0,100.0,high,manual
8520967,Raw Water Source,Are you able to take photo of the risks?,15730920,1749652214711.0,Raw Water Source,Are you able to take photo of the risks for the ground water source?,1749693763656.0,0.0,none,manual
8520967,Raw Water Source,Take photo of the risks,2630922,1749652214711.0,Raw Water Source,Take Photo of risks for the ground water source,1749693801234.0,100.0,high,manual
8520967,Raw Water Source,Take Photo of source,4530920,1749652214711.0,Raw Water Source,Take photo of the surface water source,1749693516243.0,100.0,high,manual
8520967,Raw Water Source,Take photo of the risks,6620926,1749652214711.0,Raw Water Source,Take Photo of risks for the surface water source,1749693763655.0,100.0,high,manual
8520967,Raw Water Source,Are you able to visit the raw water source?,9790920,1749652214711.0,Raw Water Source,Are you able to visit the surface water source in this visit?,1749693489743.0,88.46,medium,manual
8520967,Reservoirs,Take Photo,10700924,1749652214711.0,Take photo of the Distribution Reservoir,,1749699773294.0,100.0,high,manual
8520967,Reservoirs,Take photo,19520923,1749652214711.0,Reservoirs,Take Photo of the storage reservoir,1749699656363.0,100.0,high,manual
8520967,Staff and General Information,What are the constraints or recommendations for professional developments?,510927,,,,,0.0,none,manual
8520967,Water Quality,What is the Alkalinity in mg/L?,23540929,,,,,0.0,none,manual
8520967,Water Quality,What is the Temperature in Degrees Celcius?,23560933,1749652214711.0,Water Quality,Temperature \u00b0C - 2550B (APHA Method Code),1754995300101.0,100.0,high,manual
8520967,Water Quality,What is the Salinity in PPT?,24540928,1749652214711.0,Water Quality,Salinity PPT 2520B 0.2 (APHA Method Code),1754995300104.0,100.0,high,manual
8520967,Water Quality,What is the pH?,28320926,1749652214711.0,Water Quality,pH - 4500-H+B (APHA Method Code),1754995300102.0,100.0,high,manual
